{"caseId":"before","intake":{"connectionMode":"direct","dataSensitivity":"synthetic","environment":"local-lab","expectedBehavior":"The application can count project labels.","relation":"project_labels","report":"Synthetic application cannot resolve project_labels.","schemaVersion":1,"sqlstate":"42P01"},"profile":"local-lab","schemaVersion":3,"scope":{"branchFingerprint":"d5375c5c6948a8af82f9bebee53d65e9998a1f0ab6f997c03ce78995eb4cc654","connectionMode":"direct","environment":"local-lab","identityMethod":"lab-marker","roleFingerprint":"c905a111f58020f68632f0c0f62d5025cf89e989198f66d482221f4c6f54c15b"},"subject":{"expectedBranchFingerprint":"d5375c5c6948a8af82f9bebee53d65e9998a1f0ab6f997c03ce78995eb4cc654","migrationId":"002_project_labels","queryShapeHash":"45edcebd892dd8472a1ce3af18b669b4f91354cde1d34bbd12b4e37e0201ccf8","relation":"project_labels","schema":"app_data"}}
