{"caseId":"search-path-control","intake":{"connectionMode":"direct","dataSensitivity":"synthetic","environment":"local-lab","expectedBehavior":"The application can count project labels.","relation":"project_labels","report":"Synthetic application cannot resolve project_labels.","schemaVersion":1,"sqlstate":"42P01"},"profile":"local-lab","schemaVersion":3,"scope":{"branchFingerprint":"f5e29fbec249490bfa5c514ff3a764a4fd8d32f7569e2b9307eb8c7f67c502ca","connectionMode":"direct","environment":"local-lab","identityMethod":"lab-marker","roleFingerprint":"c905a111f58020f68632f0c0f62d5025cf89e989198f66d482221f4c6f54c15b"},"subject":{"expectedBranchFingerprint":"f5e29fbec249490bfa5c514ff3a764a4fd8d32f7569e2b9307eb8c7f67c502ca","migrationId":"002_project_labels","queryShapeHash":"45edcebd892dd8472a1ce3af18b669b4f91354cde1d34bbd12b4e37e0201ccf8","relation":"project_labels","schema":"app_data"}}
