{"caseId":"development","intake":{"connectionMode":"direct","dataSensitivity":"synthetic","environment":"local-lab","expectedBehavior":"The application can count project labels.","relation":"project_labels","report":"Synthetic application cannot resolve project_labels.","schemaVersion":1,"sqlstate":"42P01"},"profile":"local-lab","schemaVersion":3,"scope":{"branchFingerprint":"f459b300a04c46a3346b6821bab8c5a58eece4b3a27162bf7367a13c47cede05","connectionMode":"direct","environment":"local-lab","identityMethod":"lab-marker","roleFingerprint":"c905a111f58020f68632f0c0f62d5025cf89e989198f66d482221f4c6f54c15b"},"subject":{"expectedBranchFingerprint":"f459b300a04c46a3346b6821bab8c5a58eece4b3a27162bf7367a13c47cede05","migrationId":"002_project_labels","queryShapeHash":"45edcebd892dd8472a1ce3af18b669b4f91354cde1d34bbd12b4e37e0201ccf8","relation":"project_labels","schema":"app_data"}}
